SKU Code,Master SKU,Inventory SKU,Pack Combo SKU,SKU Type (SINGLE/COMBO),Inventory Bypass (YES/NO),Ops Tag,Category,Product Title,Meta Tags,HD Image URL,White BG URL,Dim Image URL,Alt Image 1,Alt Image 2,No. of Constituents,Weight (grams),Dimensions (L x W x H cm),Bulk Price (INR),Search Keywords,Material
[Unique SKU e.g. CRTOR500],[Same as SKU if standalone product],[Same as SKU if standalone],[Combo parent SKU if part of a bundle else NA],[SINGLE for individual item COMBO for bundle],[YES only if stock tracking is bypassed else NO],[Ops team tag e.g. LS SM GF],[Product category e.g. Showpiece - Feng Shui],[Full product title as it appears on listing],[Short descriptive tags for internal use],[URL to high-resolution product image],[URL to white background image],[URL to dimensions/measurements image],[URL to extra product image optional],[URL to extra product image optional],[1 for single item 2 or more for a set],[Weight of the product in grams],[e.g. 11.5 x 11.5 x 4],[Price per unit in INR e.g. 99],[Comma-separated keywords used for search],[Primary material e.g. Crystal Resin Bamboo Canvas]
CRTOR500,CRTOR500,CRTOR500,NA,SINGLE,NO,LS,Showpiece - Feng Shui,eCraftIndia Crystal Tortoise Feng Shui Showpiece,Showpiece Fengshui Lucky Tortoise,https://cdn.ecraftindia.com/CRTOR500_hd.jpg,https://cdn.ecraftindia.com/CRTOR500_white.jpg,https://cdn.ecraftindia.com/CRTOR500_dim.jpg,,,1,150,11.5 x 11.5 x 4,99,crystal tortoise feng shui lucky gift,Crystal
MSGB589,MSGB589,MSGB589,NA,SINGLE,NO,LS,Showpiece - Human Figurine,eCraftIndia Set of 4 Monk Child Buddhas,Showpiece Buddha Monk Meditation,https://cdn.ecraftindia.com/MSGB589_hd.jpg,https://cdn.ecraftindia.com/MSGB589_white.jpg,https://cdn.ecraftindia.com/MSGB589_dim.jpg,,,4,320,12 x 5 x 7,132,buddha monk set gift home decor,Resin
MSAC503,MSAC503,MSAC503,NA,SINGLE,NO,SM,Showpiece - Animal Figurines,eCraftIndia Giraffe Resin Decorative Showpiece,Showpiece Animal Figurine Giraffe,https://cdn.ecraftindia.com/MSAC503_hd.jpg,https://cdn.ecraftindia.com/MSAC503_white.jpg,https://cdn.ecraftindia.com/MSAC503_dim.jpg,,,1,420,19.5 x 9 x 13.5,198,giraffe animal figurine desk decor gift,Resin
VGNS101,VGNS101,VGNS101,NA,SINGLE,NO,LS,Wall Art - Canvas,eCraftIndia Lord Ganesha Printed Canvas Wall Art,Wall Art Ganesha Religious Canvas,https://cdn.ecraftindia.com/VGNS101_hd.jpg,https://cdn.ecraftindia.com/VGNS101_white.jpg,https://cdn.ecraftindia.com/VGNS101_dim.jpg,,,1,600,45 x 2 x 60,450,ganesha canvas wall art religious home decor,Canvas MDF
HBMBX202,HBMBX202,HBMBX202,NA,SINGLE,NO,GF,Gifts - Gift Box,eCraftIndia Handmade Decorative Bamboo Gift Box,Gift Box Bamboo Handmade,https://cdn.ecraftindia.com/HBMBX202_hd.jpg,https://cdn.ecraftindia.com/HBMBX202_white.jpg,https://cdn.ecraftindia.com/HBMBX202_dim.jpg,,,1,280,20 x 15 x 10,249,bamboo gift box handmade storage box,Bamboo
